conceptId,conceptName,vocabularyId,domainId,standardConcept,conceptInSet,rc,dc,drc,dbc
4212101,Aneurysm of pancreaticoduodenal artery,SNOMED,Condition,S,Not included - descendant,200,2,200,2
40491480,Aneurysm of aortic sinus of Valsalva with rupture to right atrium,SNOMED,Condition,S,Not included - descendant,200,2,200,2
4347063,Idiopathic aortitis,SNOMED,Condition,S,Not included - descendant,200,2,200,2
40482911,Aortic sinus of Valsalva aneurysm from left coronary sinus,SNOMED,Condition,S,Not included - descendant,200,2,200,2
4121633,Dissection of femoral artery,SNOMED,Condition,S,Not included - descendant,200,2,200,2
4113291,Cervical aortic arch,SNOMED,Condition,S,Not included - descendant,200,2,200,2
4110201,Ulnar artery aneurysm,SNOMED,Condition,S,Not included - descendant,200,2,200,2
4111707,Ruptured berry aneurysm,SNOMED,Condition,S,Not included - descendant,200,2,200,2
4068829,Persistent aortic arch convolutions,SNOMED,Condition,S,Not included - descendant,200,2,200,2
4137555,Thrombosis of aortic bifurcation bypass graft,SNOMED,Condition,S,Not included - descendant,200,2,200,2
4067211,Aorto-esophageal fistula,SNOMED,Condition,S,Not included - descendant,200,2,200,2
4079431,Ruptured aneurysm of middle cerebral artery,SNOMED,Condition,S,Not included - descendant,200,2,200,2
4237180,Pontine artery occlusion,SNOMED,Condition,S,Not included - descendant,200,2,200,2
4194886,External iliac artery occlusion,SNOMED,Condition,S,Not included - descendant,200,2,200,2
4187938,Multiple renal arteries,SNOMED,Condition,S,Not included - descendant,200,2,200,2
193907,Superior mesenteric artery trunk injury,SNOMED,Condition,S,Not included - descendant,200,2,200,2
4112154,Leaking abdominal aortic aneurysm,SNOMED,Condition,S,Not included - descendant,200,2,200,2
4336004,Branch macular artery occlusion,SNOMED,Condition,S,Not included - descendant,200,2,200,2
37110252,Dissection of ascending aorta and aortic arch,SNOMED,Condition,S,Not included - descendant,200,2,200,2
36715882,Vasculitis of mesenteric artery,SNOMED,Condition,S,Not included - descendant,200,2,200,2
4078315,Top of basilar syndrome,SNOMED,Condition,S,Not included - descendant,200,2,200,2
4121625,Common iliac artery stenosis,SNOMED,Condition,S,Not included - descendant,200,2,200,2
4124838,Critical upper limb ischemia,SNOMED,Condition,S,Not included - descendant,200,2,200,2
4327503,Stricture of aorta,SNOMED,Condition,S,Not included - descendant,200,2,200,2
4193055,Inflammatory abdominal aortic aneurysm,SNOMED,Condition,S,Not included - descendant,200,2,200,2
4079430,Ruptured aneurysm of anterior cerebral artery,SNOMED,Condition,S,Not included - descendant,200,2,200,2
40488004,Aberrant origin of left subclavian artery,SNOMED,Condition,S,Not included - descendant,200,2,200,2
4031930,Aneurysm of common carotid artery,SNOMED,Condition,S,Not included - descendant,200,2,200,2
37017075,Nontraumatic ruptured cerebral aneurysm,SNOMED,Condition,S,Not included - descendant,200,2,200,2
4237181,Pontine artery thrombosis,SNOMED,Condition,S,Not included - descendant,200,2,200,2
43022064,Atherosclerosis of aortoiliac bypass graft,SNOMED,Condition,S,Not included - descendant,200,2,200,2
4142292,Thrombosis of renal artery bypass graft,SNOMED,Condition,S,Not included - descendant,200,2,200,2
4235766,Duodenoaortic fistula,SNOMED,Condition,S,Not included - descendant,200,2,200,2
4244959,Congenital dilatation of aortic arch,SNOMED,Condition,S,Not included - descendant,200,2,200,2
4111848,Embolism and thrombosis of the posterior tibial artery,SNOMED,Condition,S,Not included - descendant,200,2,200,2
36716757,Perinatal arterial ischemic stroke,SNOMED,Condition,S,Not included - descendant,200,2,200,2
4128904,Traumatic rupture of aorta,SNOMED,Condition,S,Not included - descendant,200,2,200,2
4054892,Celiac or mesenteric artery injury,SNOMED,Condition,S,Not included - descendant,200,2,200,2
4218956,Postductal coarctation of aorta,SNOMED,Condition,S,Not included - descendant,200,2,200,2
4208071,Critical ischemia of foot,SNOMED,Condition,S,Not included - descendant,200,2,200,2
4146012,Trash foot,SNOMED,Condition,S,Not included - descendant,200,2,200,2
4348319,Acute mesenteric arterial occlusion,SNOMED,Condition,S,Not included - descendant,200,2,200,2
4082162,Ruptured aneurysm of posterior inferior cerebellar artery,SNOMED,Condition,S,Not included - descendant,200,2,200,2
4198453,False aneurysm of hepatic artery,SNOMED,Condition,S,Not included - descendant,200,2,200,2
4144981,Aneurysm of gastroduodenal artery,SNOMED,Condition,S,Not included - descendant,200,2,200,2
4246955,Congenital stenosis of carotid artery,SNOMED,Condition,S,Not included - descendant,200,2,200,2
4119614,Femoral artery embolus,SNOMED,Condition,S,Not included - descendant,200,2,200,2
4223098,Hepatic artery thrombosis,SNOMED,Condition,S,Not included - descendant,200,2,200,2
4168060,Gardner-Diamond syndrome,SNOMED,Condition,S,Not included - descendant,200,2,200,2
36717625,Penetrating ulcer of aorta,SNOMED,Condition,S,Not included - descendant,200,2,200,2
4009654,Arterial thrombosis of spinal cord,SNOMED,Condition,S,Not included - descendant,200,2,200,2
4108377,Embolism and thrombosis of the dorsalis pedis artery,SNOMED,Condition,S,Not included - descendant,200,2,200,2
37395562,Multi-infarct dementia due to atherosclerosis,SNOMED,Condition,S,Not included - descendant,200,2,200,2
437147,Injury of internal mammary artery,SNOMED,Condition,S,Not included - descendant,200,2,200,2
4201941,Recurrent abdominal aortic aneurysm,SNOMED,Condition,S,Not included - descendant,200,2,200,2
4111852,Embolism and thrombosis of the celiac artery,SNOMED,Condition,S,Not included - descendant,200,2,200,2
40489292,Thromboembolus of precerebral artery,SNOMED,Condition,S,Not included - descendant,200,2,200,2
4128218,Acquired renal artery aneurysm,SNOMED,Condition,S,Not included - descendant,200,2,200,2
4030379,Preductal coarctation of aorta,SNOMED,Condition,S,Not included - descendant,200,2,200,2
4175569,Common femoral artery thrombosis,SNOMED,Condition,S,Not included - descendant,200,2,200,2
4142291,Occlusion of aortic bifurcation bypass graft,SNOMED,Condition,S,Not included - descendant,200,2,200,2
4263648,Dermite ocre of Favre,SNOMED,Condition,S,Not included - descendant,200,2,200,2
4032493,Multiple AND bilateral precerebral artery thrombosis,SNOMED,Condition,S,Not included - descendant,200,2,200,2
4079433,Ruptured aneurysm of anterior communicating artery,SNOMED,Condition,S,Not included - descendant,200,2,200,2
4247959,Congenital retinal aneurysm,SNOMED,Condition,S,Not included - descendant,200,2,200,2
4112165,Embolism and thrombosis of the splenic artery,SNOMED,Condition,S,Not included - descendant,200,2,200,2
4121626,External iliac artery stenosis,SNOMED,Condition,S,Not included - descendant,200,2,200,2
4246951,Congenital stenosis of aortic arch,SNOMED,Condition,S,Not included - descendant,200,2,200,2
4109477,Interrupted aortic arch distal to left subclavian artery,SNOMED,Condition,S,Not included - descendant,200,2,200,2
4142981,Aneurysm of supraceliac aorta,SNOMED,Condition,S,Not included - descendant,200,2,200,2
4033350,Secondary cutaneous vasculitis,SNOMED,Condition,S,Not included - descendant,200,2,200,2
4210025,Vascular compression of esophagus by aberrant right subclavian artery arising from descending aorta,SNOMED,Condition,S,Not included - descendant,200,2,200,2
42873055,Coarctation of infrarenal abdominal aorta,SNOMED,Condition,S,Not included - descendant,200,2,200,2
4320938,Pseudocoarctation of aorta,SNOMED,Condition,S,Not included - descendant,200,2,200,2
4262102,Medionecrosis of aorta,SNOMED,Condition,S,Not included - descendant,200,2,200,2
40482912,Aortic sinus of Valsalva aneurysm from right coronary sinus,SNOMED,Condition,S,Not included - descendant,200,2,200,2
4109466,Sinus of Valsalva aneurysm with rupture,SNOMED,Condition,S,Not included - descendant,200,2,200,2
4197396,Hepatic artery embolism,SNOMED,Condition,S,Not included - descendant,200,2,200,2
4322723,False aneurysm of distal brachial artery,SNOMED,Condition,S,Not included - descendant,200,2,200,2
4178400,External iliac artery thrombosis,SNOMED,Condition,S,Not included - descendant,200,2,200,2
4010874,Retinal arteritis,SNOMED,Condition,S,Not included - descendant,200,2,200,2
4119999,Chronic peri-aortitis,SNOMED,Condition,S,Not included - descendant,200,2,200,2
762628,Posterior cerebral artery embolism,SNOMED,Condition,S,Not included - descendant,100,1,200,2
40493454,Obstruction of aortic outflow,SNOMED,Condition,S,Not included - descendant,100,1,200,1
4109347,Localized supravalvar aortic stenosis,SNOMED,Condition,S,Not included - descendant,100,1,200,1
42535143,Atherosclerosis of left iliac artery,SNOMED,Condition,S,Not included - descendant,100,1,200,1
42539276,Occlusion of right middle cerebral artery,SNOMED,Condition,S,Not included - descendant,100,1,200,1
4143890,Rupture popliteal artery,SNOMED,Condition,S,Not included - descendant,100,1,200,1
42536635,Acute aortoiliac occlusion,SNOMED,Condition,S,Not included - descendant,100,1,200,1
36713015,Atherosclerosis of right iliac artery,SNOMED,Condition,S,Not included - descendant,100,1,200,1
42536634,Acute occlusion of artery of upper limb,SNOMED,Condition,S,Not included - descendant,100,1,200,1
42535456,Occlusion of right vertebral artery,SNOMED,Condition,S,Not included - descendant,100,1,200,1
45766110,Asymptomatic occlusion of anterior cerebral artery,SNOMED,Condition,S,Not included - descendant,187,1,187,1
36717012,Aneurysm of right femoral artery,SNOMED,Condition,S,Not included - descendant,172,1,172,1
36713013,Occlusion of right femoral artery,SNOMED,Condition,S,Not included - descendant,169,1,169,1
36712807,Pain at rest of right lower limb co-occurrent and due to atherosclerosis,SNOMED,Condition,S,Not included - descendant,163,1,163,1
761930,Asymptomatic carotid artery stenosis,SNOMED,Condition,S,Not included - descendant,153,1,153,1
37109921,Acute occlusion of artery of lower limb co-occurrent and due to thromboembolus,SNOMED,Condition,S,Not included - descendant,139,1,139,1
36712962,Aneurysm of left femoral artery,SNOMED,Condition,S,Not included - descendant,135,1,135,1
36712957,Aneurysm of left common iliac artery,SNOMED,Condition,S,Not included - descendant,133,1,133,1
36712961,Aneurysm of left popliteal artery,SNOMED,Condition,S,Not included - descendant,132,1,132,1
765907,Occlusion and stenosis of middle cerebral artery with infarction,SNOMED,Condition,S,Not included - descendant,124,1,124,1
36713012,Occlusion of left femoral artery,SNOMED,Condition,S,Not included - descendant,114,1,114,1
36712960,Aneurysm of right popliteal artery,SNOMED,Condition,S,Not included - descendant,112,1,112,1
36712809,Aneurysm of right renal artery,SNOMED,Condition,S,Not included - descendant,107,1,107,1
42535836,Stenosis of left vertebral artery,SNOMED,Condition,S,Not included - descendant,107,1,107,1
4112155,Anterior tibial aneurysm,SNOMED,Condition,S,Not included - descendant,100,1,100,1
4322809,Aneurysm of gastroepiploic artery,SNOMED,Condition,S,Not included - descendant,100,1,100,1
4070297,Pentalogy of Fallot,SNOMED,Condition,S,Not included - descendant,100,1,100,1
42535874,Thrombosis of left middle cerebral artery,SNOMED,Condition,S,Not included - descendant,100,1,100,1
4124843,Common femoral aneurysm,SNOMED,Condition,S,Not included - descendant,100,1,100,1
42536825,Laceration of deep palmar arch,SNOMED,Condition,S,Not included - descendant,100,1,100,1
764734,Pseudoaneurysm of vertebral artery,SNOMED,Condition,S,Not included - descendant,100,1,100,1
42539787,Occlusion of right posterior cerebral artery,SNOMED,Condition,S,Not included - descendant,100,1,100,1
762701,Basilar artery occlusion without infarction,SNOMED,Condition,S,Not included - descendant,100,1,100,1
42535106,Acquired right carotid cavernous fistula,SNOMED,Condition,S,Not included - descendant,100,1,100,1
40491456,Aneurysm of aortic sinus of Valsalva with rupture to left atrium,SNOMED,Condition,S,Not included - descendant,100,1,100,1
4055025,Superior mesenteric artery embolus,SNOMED,Condition,S,Not included - descendant,100,1,100,1
4108380,Embolism and thrombosis of the subclavian artery,SNOMED,Condition,S,Not included - descendant,100,1,100,1
4070929,Anomalous origin of the aortic arch,SNOMED,Condition,S,Not included - descendant,100,1,100,1
37016147,Occlusion of renal artery due to embolism,SNOMED,Condition,S,Not included - descendant,100,1,100,1
4194897,Multiple AND bilateral precerebral artery obstruction,SNOMED,Condition,S,Not included - descendant,100,1,100,1
4108750,Interrupted aortic arch between left common carotid and brachiocephalic artery,SNOMED,Condition,S,Not included - descendant,100,1,100,1
42536824,Laceration of superficial palmar arch,SNOMED,Condition,S,Not included - descendant,100,1,100,1
763093,Carotid artery stenosis without infarction,SNOMED,Condition,S,Not included - descendant,100,1,100,1
4301023,Secondary erythromelalgia,SNOMED,Condition,S,Not included - descendant,100,1,100,1
4294425,Purpura due to prolonged vomiting and/or coughing,SNOMED,Condition,S,Not included - descendant,100,1,100,1
43020504,Shone complex,SNOMED,Condition,S,Not included - descendant,100,1,100,1
4055594,"Closed injury, anterior tibial artery",SNOMED,Condition,S,Not included - descendant,100,1,100,1
40488007,Aneurysm of aortic sinus of Valsalva with protrusion into right atrium,SNOMED,Condition,S,Not included - descendant,100,1,100,1
4109316,Ascending aortic atresia,SNOMED,Condition,S,Not included - descendant,100,1,100,1
4031045,Anterior choroidal artery syndrome,SNOMED,Condition,S,Not included - descendant,100,1,100,1
4110331,Embolism and thrombosis of the ulnar artery,SNOMED,Condition,S,Not included - descendant,100,1,100,1
4108364,Extremity artery atheroma,SNOMED,Condition,S,Not included - descendant,100,1,100,1
4055590,"Open injury, superficial femoral artery",SNOMED,Condition,S,Not included - descendant,100,1,100,1
4109469,Right aortic arch and right descending aorta,SNOMED,Condition,S,Not included - descendant,100,1,100,1
4244961,Congenital dilatation of carotid artery,SNOMED,Condition,S,Not included - descendant,100,1,100,1
42535512,Cerebrovascular accident due to thrombus of right carotid artery,SNOMED,Condition,S,Not included - descendant,100,1,100,1
4229401,Platelet-fibrin retinal embolus,SNOMED,Condition,S,Not included - descendant,100,1,100,1
4175579,Suprarenal artery aneurysm,SNOMED,Condition,S,Not included - descendant,100,1,100,1
36712959,Aneurysm of left internal iliac artery,SNOMED,Condition,S,Not included - descendant,100,1,100,1
45766073,Occlusion of internal auditory artery,SNOMED,Condition,S,Not included - descendant,100,1,100,1
4111847,Peripheral artery spasm,SNOMED,Condition,S,Not included - descendant,100,1,100,1
764102,Abdominal aortic aneurysm greater than 5.5 centimeters in male,SNOMED,Condition,S,Not included - descendant,100,1,100,1
42539417,Thrombosis of right carotid artery,SNOMED,Condition,S,Not included - descendant,100,1,100,1
43021718,Acquired complete obstruction of aortic arch,SNOMED,Condition,S,Not included - descendant,100,1,100,1
4137219,Chronic nontraumatic dissection of thoracic aorta,SNOMED,Condition,S,Not included - descendant,100,1,100,1
36713094,Peripheral angiopathy due to type 1 diabetes mellitus,SNOMED,Condition,S,Not included - descendant,100,1,100,1
37116421,Acute occlusion of artery of upper limb caused by thromboembolus,SNOMED,Condition,S,Not included - descendant,100,1,100,1
37119077,Asymptomatic stenosis of intracranial artery,SNOMED,Condition,S,Not included - descendant,100,1,100,1
42535107,Acquired left carotid cavernous fistula,SNOMED,Condition,S,Not included - descendant,100,1,100,1
40488394,Aneurysm of aortic sinus of Valsalva with protrusion into left ventricle,SNOMED,Condition,S,Not included - descendant,100,1,100,1
43021317,Vascular ring with right aortic arch and left arterial duct from anomalous retroesophageal left subclavian artery,SNOMED,Condition,S,Not included - descendant,100,1,100,1
43021316,Vascular ring with right aortic arch and left arterial ligament with anomalous retroesophageal left subclavian artery,SNOMED,Condition,S,Not included - descendant,100,1,100,1
4245436,Congenital dilatation of subclavian artery,SNOMED,Condition,S,Not included - descendant,100,1,100,1
42539014,Embolus of right posterior cerebral artery,SNOMED,Condition,S,Not included - descendant,100,1,100,1
42539166,Cerebrovascular accident due to thrombus of left carotid artery,SNOMED,Condition,S,Not included - descendant,100,1,100,1
762707,Occlusion and stenosis of posterior cerebral artery without infarction,SNOMED,Condition,S,Not included - descendant,100,1,100,1
762583,Dissecting aneurysm of middle cerebral artery,SNOMED,Condition,S,Not included - descendant,100,1,100,1
4109470,Right aortic arch and left descending aorta,SNOMED,Condition,S,Not included - descendant,100,1,100,1
46272559,Inflammation of fetal umbilical artery,SNOMED,Condition,S,Not included - descendant,100,1,100,1
40487099,Double aortic arch with right arch dominant,SNOMED,Condition,S,Not included - descendant,100,1,100,1
42538818,Occlusion of right middle cerebral artery by embolus,SNOMED,Condition,S,Not included - descendant,100,1,100,1
42535096,Thrombosis of right vertebral artery,SNOMED,Condition,S,Not included - descendant,100,1,100,1
4264734,Thromboembolism of renal arteries,SNOMED,Condition,S,Not included - descendant,100,1,100,1
4152613,Dynamic aortic outflow tract obstruction,SNOMED,Condition,S,Not included - descendant,100,1,100,1
37110240,Asymptomatic stenosis of extracranial artery,SNOMED,Condition,S,Not included - descendant,100,1,100,1
42535511,Cerebrovascular accident due to thrombus of basilar artery,SNOMED,Condition,S,Not included - descendant,100,1,100,1
4064193,O/E - retinal microaneurysms,SNOMED,Condition,S,Not included - descendant,100,1,100,1
42536842,Laceration of popliteal artery,SNOMED,Condition,S,Not included - descendant,100,1,100,1
4108370,Posterior tibial aneurysm,SNOMED,Condition,S,Not included - descendant,100,1,100,1
36712958,Aneurysm of right internal iliac artery,SNOMED,Condition,S,Not included - descendant,100,1,100,1
40491479,Aneurysm of aortic sinus of Valsalva with rupture to pulmonary artery,SNOMED,Condition,S,Not included - descendant,100,1,100,1
40490430,Aneurysm of aortic sinus of Valsalva with rupture to pericardial cavity,SNOMED,Condition,S,Not included - descendant,100,1,100,1
4347064,Giant cell arteritis without polymyalgia rheumatica,SNOMED,Condition,S,Not included - descendant,100,1,100,1
762341,Occlusion of right anterior cerebral artery,SNOMED,Condition,S,Not included - descendant,100,1,100,1
764722,Thrombosis of posterior cerebral artery,SNOMED,Condition,S,Not included - descendant,100,1,100,1
45766088,Asymptomatic occlusion of extracranial carotid artery,SNOMED,Condition,S,Not included - descendant,100,1,100,1
4002631,Congenital stricture of cerebral artery,SNOMED,Condition,S,Not included - descendant,100,1,100,1
4095428,Injury of anterior spinal artery,SNOMED,Condition,S,Not included - descendant,100,1,100,1
37108913,Dissection of left vertebral artery,SNOMED,Condition,S,Not included - descendant,100,1,100,1
40488006,Aneurysm of aortic sinus of Valsalva with protrusion into pulmonary artery,SNOMED,Condition,S,Not included - descendant,100,1,100,1
45766128,Familial cerebral saccular aneurysm,SNOMED,Condition,S,Not included - descendant,100,1,100,1
762756,Arteriosclerosis of renal artery,SNOMED,Condition,S,Not included - descendant,100,1,100,1
42535097,Thrombosis of left vertebral artery,SNOMED,Condition,S,Not included - descendant,100,1,100,1
4144633,Thrombosis of axillofemoral bypass graft,SNOMED,Condition,S,Not included - descendant,100,1,100,1
36712950,Aneurysm of intracranial portion of right internal carotid artery,SNOMED,Condition,S,Not included - descendant,100,1,100,1
4244374,Ruptured sinus of Valsalva into left ventricle,SNOMED,Condition,S,Not included - descendant,100,1,100,1
4146010,Infected femoropopliteal graft,SNOMED,Condition,S,Not included - descendant,100,1,100,1
37117127,Dissection of external carotid artery,SNOMED,Condition,S,Not included - descendant,100,1,100,1
4115229,Digital arterial thrombosis,SNOMED,Condition,S,Not included - descendant,100,1,100,1
43020423,Posterior tibial artery insufficiency,SNOMED,Condition,S,Not included - descendant,100,1,100,1
37110251,Non-atherosclerotic chronic arterial occlusive disease,SNOMED,Condition,S,Not included - descendant,100,1,100,1
43020490,Aneurysm of extracranial portion of internal carotid artery,SNOMED,Condition,S,Not included - descendant,100,1,100,1
4120105,Superficial femoral aneurysm,SNOMED,Condition,S,Not included - descendant,100,1,100,1
4050546,"Open injury, brachial artery",SNOMED,Condition,S,Not included - descendant,100,1,100,1
43021429,Anomalous common origin of brachiocephalic artery and left common carotid artery,SNOMED,Condition,S,Not included - descendant,100,1,100,1
36713014,Atherosclerosis of bilateral iliac arteries,SNOMED,Condition,S,Not included - descendant,100,1,100,1
42535094,Subclavian steal syndrome of right subclavian artery,SNOMED,Condition,S,Not included - descendant,100,1,100,1
40491454,Abnormal course of aortic arch and descending aorta,SNOMED,Condition,S,Not included - descendant,100,1,100,1
4187858,Annular abscess of aortic root,SNOMED,Condition,S,Not included - descendant,100,1,100,1
42535092,Dilatation of aortic root co-occurrent and due to Marfan syndrome,SNOMED,Condition,S,Not included - descendant,100,1,100,1
4263089,Stasis purpura,SNOMED,Condition,S,Not included - descendant,100,1,100,1
4041678,Intracranial arterial septic embolism,SNOMED,Condition,S,Not included - descendant,100,1,100,1
43021633,Congenital atresia of aortic arch,SNOMED,Condition,S,Not included - descendant,100,1,100,1
4055473,"Closed injury, axillary artery",SNOMED,Condition,S,Not included - descendant,100,1,100,1
4109319,Left aortic arch and right descending aorta,SNOMED,Condition,S,Not included - descendant,100,1,100,1
40486227,Residual coarctation of aorta,SNOMED,Condition,S,Not included - descendant,100,1,100,1
42535113,Cerebrovascular accident due to thrombus of right middle cerebral artery,SNOMED,Condition,S,Not included - descendant,100,1,100,1
764100,Abdominal aortic aneurysm 3.0 to 5.5 centimeters in male,SNOMED,Condition,S,Not included - descendant,100,1,100,1
4055477,"Open injury, radial artery",SNOMED,Condition,S,Not included - descendant,100,1,100,1
4245320,Congenital absence of carotid artery,SNOMED,Condition,S,Not included - descendant,100,1,100,1
45766108,Asymptomatic occlusion of posterior cerebral artery,SNOMED,Condition,S,Not included - descendant,100,1,100,1
762754,Arteriosclerosis of thoracic aorta,SNOMED,Condition,S,Not included - descendant,100,1,100,1
4132551,Injury of middle colic artery,SNOMED,Condition,S,Not included - descendant,100,1,100,1
42538671,Tetralogy of Fallot with pulmonary atresia and systemic-to-pulmonary collateral artery,SNOMED,Condition,S,Not included - descendant,100,1,100,1
37116422,Acute occlusion of artery of upper limb caused by thrombus,SNOMED,Condition,S,Not included - descendant,100,1,100,1
762700,Carotid artery occlusion without infarction,SNOMED,Condition,S,Not included - descendant,100,1,100,1
4259004,Congenital hypoplasia of umbilical artery,SNOMED,Condition,S,Not included - descendant,100,1,100,1
762926,Occlusion of internal carotid artery,SNOMED,Condition,S,Not included - descendant,100,1,100,1
42537643,Dissection of basilar artery,SNOMED,Condition,S,Not included - descendant,100,1,100,1
4079021,Ruptured internal carotid-anterior communicating artery zone aneurysm,SNOMED,Condition,S,Not included - descendant,100,1,100,1
763095,Posterior inferior cerebellar artery occlusion with infarction,SNOMED,Condition,S,Not included - descendant,100,1,100,1
4311006,Dural carotid cavernous fistula,SNOMED,Condition,S,Not included - descendant,100,1,100,1
37109922,Acute occlusion of aortoiliac artery due to thrombosis,SNOMED,Condition,S,Not included - descendant,100,1,100,1
40486131,Dilatation of aortic sinutubular junction,SNOMED,Condition,S,Not included - descendant,100,1,100,1
40479593,Nonischemic priapism,SNOMED,Condition,S,Not included - descendant,100,1,100,1
43021721,Acquired luminal obstruction of aortic arch between subclavian artery and common carotid artery,SNOMED,Condition,S,Not included - descendant,100,1,100,1
765609,Vertebral artery stenosis without infarction,SNOMED,Condition,S,Not included - descendant,100,1,100,1
42535098,Bilateral vertebral artery occlusion,SNOMED,Condition,S,Not included - descendant,100,1,100,1
4139417,Rupture femoral artery,SNOMED,Condition,S,Not included - descendant,100,1,100,1
762585,Dissecting aneurysm of anterior cerebral artery,SNOMED,Condition,S,Not included - descendant,100,1,100,1
42538826,Stenosis of left cerebellar artery,SNOMED,Condition,S,Not included - descendant,100,1,100,1
42539411,Stenosis of right vertebral artery,SNOMED,Condition,S,Not included - descendant,100,1,100,1
4216555,Injury of suprarenal arteries,SNOMED,Condition,S,Not included - descendant,100,1,100,1
765495,Occlusion and stenosis of middle cerebral artery without infarction,SNOMED,Condition,S,Not included - descendant,100,1,100,1
37110254,External iliac artery endofibrosis,SNOMED,Condition,S,Not included - descendant,100,1,100,1
4213638,Aneurysm of axillary artery,SNOMED,Condition,S,Not included - descendant,100,1,100,1
4120112,Cerebral steal syndrome,SNOMED,Condition,S,Not included - descendant,100,1,100,1
4301022,Primary erythromelalgia,SNOMED,Condition,S,Not included - descendant,100,1,100,1
4009154,Atheroma of cerebral arteries,SNOMED,Condition,S,Not included - descendant,100,1,100,1
763004,Vertebral artery stenosis with infarction,SNOMED,Condition,S,Not included - descendant,100,1,100,1
45766199,Cerebral arteritis due to infectious disease,SNOMED,Condition,S,Not included - descendant,100,1,100,1
