conceptId,conceptName,vocabularyId,domainId,standardConcept,conceptInSet,rc,dc,drc,dbc
4110204,Dorsalis pedis aneurysm,SNOMED,Condition,S,Not included - descendant,0,0,0,0
35615025,Aneurysm of left brachial artery,SNOMED,Condition,S,Not included - descendant,0,0,0,0
4120111,Steal syndrome of lower limb,SNOMED,Condition,S,Not included - descendant,0,0,0,0
761750,Embolism of splenic artery,SNOMED,Condition,S,Not included - descendant,0,0,0,0
40483310,Isolation of right common carotid artery,SNOMED,Condition,S,Not included - descendant,0,0,0,0
3181089,Traumatic aortic disruption,Nebraska Lexicon,Condition,S,Not included - descendant,0,0,0,0
761464,Ischemia of right lower extremity,SNOMED,Condition,S,Not included - descendant,0,0,0,0
4236727,Traumatic aortocaval fistula,SNOMED,Condition,S,Not included - descendant,0,0,0,0
36680605,Familial cervical artery dissection,SNOMED,Condition,S,Not included - descendant,0,0,0,0
3182866,Infected aortic endograft,Nebraska Lexicon,Condition,S,Not included - descendant,0,0,0,0
4178398,Suprarenal artery embolus,SNOMED,Condition,S,Not included - descendant,0,0,0,0
764504,Occlusive thrombus of left cerebellar artery,SNOMED,Condition,S,Not included - descendant,0,0,0,0
4101013,Solitary aortic trunk with pulmonary atresia,SNOMED,Condition,S,Not included - descendant,0,0,0,0
761210,Aneurysm of left superficial temporal artery,SNOMED,Condition,S,Not included - descendant,0,0,0,0
45766085,Ruptured aneurysm of vertebral artery,SNOMED,Condition,S,Not included - descendant,0,0,0,0
765226,Atherosclerosis of autologous bypass graft of right lower limb,SNOMED,Condition,S,Not included - descendant,0,0,0,0
37204667,Aneurysm of posterior cerebral artery,SNOMED,Condition,S,Not included - descendant,0,0,0,0
4182191,Crural artery thrombosis,SNOMED,Condition,S,Not included - descendant,0,0,0,0
37209510,Dissection of left femoral artery,SNOMED,Condition,S,Not included - descendant,0,0,0,0
4052217,"Closed injury, deep plantar artery",SNOMED,Condition,S,Not included - descendant,0,0,0,0
44811348,Thrombosis of external jugular vein,SNOMED,Condition,S,Not included - descendant,0,0,0,0
36686479,Injury of right subclavian artery,SNOMED,Condition,S,Not included - descendant,0,0,0,0
36715720,Anterior cord syndrome of thoracic spinal cord at T10 level,SNOMED,Condition,S,Not included - descendant,0,0,0,0
35615107,Occlusion of left popliteal artery,SNOMED,Condition,S,Not included - descendant,0,0,0,0
43021456,Anomalous origin of right arterial ligament from left aortic arch,SNOMED,Condition,S,Not included - descendant,0,0,0,0
761412,Thrombosis of bilateral internal carotid arteries,SNOMED,Condition,S,Not included - descendant,0,0,0,0
43021452,Anomalous origin of arterial ligament from right carotid artery,SNOMED,Condition,S,Not included - descendant,0,0,0,0
35615020,Atherosclerosis of right renal artery,SNOMED,Condition,S,Not included - descendant,0,0,0,0
3174092,Right basal ganglia embolic stroke,Nebraska Lexicon,Condition,S,Not included - descendant,0,0,0,0
4174014,Inferior mesenteric artery embolus,SNOMED,Condition,S,Not included - descendant,0,0,0,0
765775,Multiple AND bilateral precerebral artery stenosis without infarction,SNOMED,Condition,S,Not included - descendant,0,0,0,0
40490948,Vascular ring with left aortic arch and right arterial duct arising from aberrant retroesophageal innominate artery,SNOMED,Condition,S,Not included - descendant,0,0,0,0
43021598,Anomalous origin of arterial ligament from unknown site,SNOMED,Condition,S,Not included - descendant,0,0,0,0
42536349,Occlusion of left cerebellar artery,SNOMED,Condition,S,Not included - descendant,0,0,0,0
35615156,Dissection of left subclavian artery,SNOMED,Condition,S,Not included - descendant,0,0,0,0
35615015,Aneurysm of extracranial portion of left internal carotid artery,SNOMED,Condition,S,Not included - descendant,0,0,0,0
35622247,"Aortic arch anomaly, facial dysmorphism, intellectual disability syndrome",SNOMED,Condition,S,Not included - descendant,0,0,0,0
42539142,Common arterial trunk with pulmonary dominance and interrupted aortic arch,SNOMED,Condition,S,Not included - descendant,0,0,0,0
40487537,Vascular ring with retrotracheal right pulmonary artery from ascending aorta,SNOMED,Condition,S,Not included - descendant,0,0,0,0
4228297,Nontraumatic dissection of thoracic aorta,SNOMED,Condition,S,Not included - descendant,0,0,0,0
40492975,Vascular ring with left aortic arch and right arterial duct ligament arising from retroesophageal aortic diverticulum with aberrant right subclavian artery,SNOMED,Condition,S,Not included - descendant,0,0,0,0
765028,Dissection of splenic artery,SNOMED,Condition,S,Not included - descendant,0,0,0,0
4079432,Ruptured aneurysm of posterior cerebral artery,SNOMED,Condition,S,Not included - descendant,0,0,0,0
35611566,Bilateral lower limb atherosclerosis pain at rest co-occurrent and due to atherosclerosis,SNOMED,Condition,S,Not included - descendant,0,0,0,0
36685005,Bilateral microaneurysm of retinal arteries,SNOMED,Condition,S,Not included - descendant,0,0,0,0
760871,Atherosclerosis of arteries of right lower limb,SNOMED,Condition,S,Not included - descendant,0,0,0,0
43021720,Acquired luminal obstruction of aortic arch distal to subclavian artery,SNOMED,Condition,S,Not included - descendant,0,0,0,0
4299127,Erythrocyanosis with nodules,SNOMED,Condition,S,Not included - descendant,0,0,0,0
40490951,Vascular ring with left aortic arch and right patent arterial duct,SNOMED,Condition,S,Not included - descendant,0,0,0,0
4180025,Profunda femoris aneurysm,SNOMED,Condition,S,Not included - descendant,0,0,0,0
761128,Aneurysm of left iliac artery,SNOMED,Condition,S,Not included - descendant,0,0,0,0
3173008,Thrombus of aortic wall,Nebraska Lexicon,Condition,S,Not included - descendant,0,0,0,0
40488440,Abnormality of thoracoabdominal aorta,SNOMED,Condition,S,Not included - descendant,0,0,0,0
3171752,Left carotid artery laceration,Nebraska Lexicon,Condition,S,Not included - descendant,0,0,0,0
37204002,Bilateral stenosis of carotid arteries,SNOMED,Condition,S,Not included - descendant,0,0,0,0
4052210,"Open injury, palmar artery",SNOMED,Condition,S,Not included - descendant,0,0,0,0
42873054,Coarctation of suprarenal abdominal aorta,SNOMED,Condition,S,Not included - descendant,0,0,0,0
43021059,Infective endarteritis at site of aortopulmonary window,SNOMED,Condition,S,Not included - descendant,0,0,0,0
37204668,Aneurysm of middle cerebral artery,SNOMED,Condition,S,Not included - descendant,0,0,0,0
43021715,Congenital luminal atresia of aortic arch distal to subclavian artery,SNOMED,Condition,S,Not included - descendant,0,0,0,0
762629,Cerebellar artery embolism,SNOMED,Condition,S,Not included - descendant,0,0,0,0
764498,Occlusive embolus of basilar artery,SNOMED,Condition,S,Not included - descendant,0,0,0,0
35615028,Bilateral atherosclerosis of lower limbs with gangrene,SNOMED,Condition,S,Not included - descendant,0,0,0,0
4143921,Ruptured sinus of Valsalva into right atrium,SNOMED,Condition,S,Not included - descendant,0,0,0,0
42538820,Occlusion of right cerebellar artery by embolus,SNOMED,Condition,S,Not included - descendant,0,0,0,0
4079120,Ruptured internal carotid bifurcation aneurysm,SNOMED,Condition,S,Not included - descendant,0,0,0,0
764445,Occlusion of anterior cerebral artery,SNOMED,Condition,S,Not included - descendant,0,0,0,0
4207618,Head and neck arterial embolus,SNOMED,Condition,S,Not included - descendant,0,0,0,0
37309672,Intramural hematoma of thoracic aorta,SNOMED,Condition,S,Not included - descendant,0,0,0,0
40487972,Recoarctation of aorta,SNOMED,Condition,S,Not included - descendant,0,0,0,0
36686411,Laceration of right renal artery,SNOMED,Condition,S,Not included - descendant,0,0,0,0
4214822,Segmental retinal periarteritis,SNOMED,Condition,S,Not included - descendant,0,0,0,0
37204825,Fibromuscular dysplasia of wall of renal artery,SNOMED,Condition,S,Not included - descendant,0,0,0,0
761853,Atherosclerosis of bypass graft of left lower limb with gangrene,SNOMED,Condition,S,Not included - descendant,0,0,0,0
43530636,Spontaneous caroticocavernous sinus fistula,SNOMED,Condition,S,Not included - descendant,0,0,0,0
36715722,Anterior cord syndrome of thoracic spinal cord at T12 level,SNOMED,Condition,S,Not included - descendant,0,0,0,0
37310024,Laceration of right popliteal artery,SNOMED,Condition,S,Not included - descendant,0,0,0,0
42536240,Embolus of left cerebellar artery,SNOMED,Condition,S,Not included - descendant,0,0,0,0
4134942,Transection of anterior spinal artery,SNOMED,Condition,S,Not included - descendant,0,0,0,0
3182789,Atherosclerosis of superior mesenteric artery,Nebraska Lexicon,Condition,S,Not included - descendant,0,0,0,0
761816,Stenosis of artery of bilateral lower limbs,SNOMED,Condition,S,Not included - descendant,0,0,0,0
37312530,Limb pain at rest due to atherosclerosis of artery of lower limb,SNOMED,Condition,S,Not included - descendant,0,0,0,0
43021635,Atresia of aortic arch with fibrous cord between subclavian artery and common carotid artery,SNOMED,Condition,S,Not included - descendant,0,0,0,0
43021455,Anomalous origin of right arterial ligament from right aortic arch,SNOMED,Condition,S,Not included - descendant,0,0,0,0
40487010,Double aortic arch with right arch dominant and coarctation of left arch,SNOMED,Condition,S,Not included - descendant,0,0,0,0
42538819,Occlusion of left middle cerebral artery by embolus,SNOMED,Condition,S,Not included - descendant,0,0,0,0
4007949,Arteriopathic granular atrophy of cerebral cortex,SNOMED,Condition,S,Not included - descendant,0,0,0,0
4143588,Occlusion of renal artery bypass graft,SNOMED,Condition,S,Not included - descendant,0,0,0,0
4139575,Infected iliopopliteal graft,SNOMED,Condition,S,Not included - descendant,0,0,0,0
43021904,Interruption of aortic arch between left common carotid artery and right common carotid artery,SNOMED,Condition,S,Not included - descendant,0,0,0,0
43021318,Vascular ring with right aortic arch and left arterial duct from retroesophageal diverticulum of aorta and anomalous left subclavian artery,SNOMED,Condition,S,Not included - descendant,0,0,0,0
4011476,Mesenteric-portal fistula,SNOMED,Condition,S,Not included - descendant,0,0,0,0
40490950,Vascular ring with left aortic arch and right arterial ligament,SNOMED,Condition,S,Not included - descendant,0,0,0,0
763035,Vertebral artery occlusion without infarction,SNOMED,Condition,S,Not included - descendant,0,0,0,0
761745,Arterial thoracic outlet syndrome of left subclavian artery,SNOMED,Condition,S,Not included - descendant,0,0,0,0
42538980,Stenosis of right cerebellar artery,SNOMED,Condition,S,Not included - descendant,0,0,0,0
3183076,Right branch retinal artery occlusion,Nebraska Lexicon,Condition,S,Not included - descendant,0,0,0,0
35615021,Atherosclerosis of left renal artery,SNOMED,Condition,S,Not included - descendant,0,0,0,0
37209533,Dissection of celiac artery,SNOMED,Condition,S,Not included - descendant,0,0,0,0
4055597,"Open injury, posterior tibial artery",SNOMED,Condition,S,Not included - descendant,0,0,0,0
43021717,Congenital luminal atresia of aortic arch between left common carotid artery and right common carotid artery,SNOMED,Condition,S,Not included - descendant,0,0,0,0
42536772,Laceration of intercostal blood vessel,SNOMED,Condition,S,Not included - descendant,0,0,0,0
4193054,Ruptured suprarenal aortic aneurysm,SNOMED,Condition,S,Not included - descendant,0,0,0,0
37204745,Congenital aneurysm of precerebral artery,SNOMED,Condition,S,Not included - descendant,0,0,0,0
37110248,Compression of trachea and esophagus co-occurrent and due to congenital anomaly of aortic arch,SNOMED,Condition,S,Not included - descendant,0,0,0,0
42538981,Occlusion of left posterior cerebral artery by embolus,SNOMED,Condition,S,Not included - descendant,0,0,0,0
45766200,Primary cerebral arteritis,SNOMED,Condition,S,Not included - descendant,0,0,0,0
761431,Atherosclerosis of nonautologous biological bypass graft of right lower limb,SNOMED,Condition,S,Not included - descendant,0,0,0,0
43021575,Congenital hypoplasia of descending aorta,SNOMED,Condition,S,Not included - descendant,0,0,0,0
37209660,Stenosis of celiac artery,SNOMED,Condition,S,Not included - descendant,0,0,0,0
761438,Macroaneurysm of retina of right eye,SNOMED,Condition,S,Not included - descendant,0,0,0,0
3173537,Arterial microemboli of left hand,Nebraska Lexicon,Condition,S,Not included - descendant,0,0,0,0
40488435,Vascular ring with left aortic arch and right arterial duct arising from aberrant retroesophageal right subclavian artery,SNOMED,Condition,S,Not included - descendant,0,0,0,0
43022040,Atresia of aortic arch with fibrous cord,SNOMED,Condition,S,Not included - descendant,0,0,0,0
37309967,Laceration of deep volar arch of right radial artery,SNOMED,Condition,S,Not included - descendant,0,0,0,0
4052208,"Closed injury, ulnar artery",SNOMED,Condition,S,Not included - descendant,0,0,0,0
4274820,Retinal artery spasm,SNOMED,Condition,S,Not included - descendant,0,0,0,0
36686408,Injury of right renal artery,SNOMED,Condition,S,Not included - descendant,0,0,0,0
40486552,Persisting fifth aortic arch with double barrell arch,SNOMED,Condition,S,Not included - descendant,0,0,0,0
36686517,Injury of right popliteal artery,SNOMED,Condition,S,Not included - descendant,0,0,0,0
4055595,"Closed injury, posterior tibial artery",SNOMED,Condition,S,Not included - descendant,0,0,0,0
36686454,Laceration of right superficial palmar arch,SNOMED,Condition,S,Not included - descendant,0,0,0,0
4108749,Postductal hypoplasia of aorta,SNOMED,Condition,S,Not included - descendant,0,0,0,0
4050548,"Open injury, ulnar artery",SNOMED,Condition,S,Not included - descendant,0,0,0,0
43021446,Anomalous origin of arterial ligament from ascending aorta,SNOMED,Condition,S,Not included - descendant,0,0,0,0
761465,Ischemia of bilateral lower limbs,SNOMED,Condition,S,Not included - descendant,0,0,0,0
761432,Atherosclerosis of autologous bypass graft of left lower limb,SNOMED,Condition,S,Not included - descendant,0,0,0,0
4132550,Injury of right colic artery,SNOMED,Condition,S,Not included - descendant,0,0,0,0
37109597,Fallot complex with intellectual disability and growth delay syndrome,SNOMED,Condition,S,Not included - descendant,0,0,0,0
35615073,Right upper limb pain co-occurrent and due to ischemia,SNOMED,Condition,S,Not included - descendant,0,0,0,0
35627150,Vasculitis with glomerulonephritis,SNOMED,Condition,S,Not included - descendant,0,0,0,0
43021441,Anomalous insertion of arterial ligament into distal left pulmonary artery,SNOMED,Condition,S,Not included - descendant,0,0,0,0
36715716,Anterior cord syndrome of thoracic spinal cord at T5 level,SNOMED,Condition,S,Not included - descendant,0,0,0,0
761429,Atherosclerosis of nonautologous biological bypass graft of left lower limb,SNOMED,Condition,S,Not included - descendant,0,0,0,0
4181456,Cystic adventitial disease of popliteal artery,SNOMED,Condition,S,Not included - descendant,0,0,0,0
37312002,Contusion of deep palmar arch,SNOMED,Condition,S,Not included - descendant,0,0,0,0
42539161,Occlusion of left cerebellar artery by embolus,SNOMED,Condition,S,Not included - descendant,0,0,0,0
3174271,Right middle cerebral artery stroke,Nebraska Lexicon,Condition,S,Not included - descendant,0,0,0,0
4055479,"Closed injury, digital artery",SNOMED,Condition,S,Not included - descendant,0,0,0,0
40488970,Malalignment of aortic sinus in relation to pulmonary sinus,SNOMED,Condition,S,Not included - descendant,0,0,0,0
3176677,Venous varix of jugular vein,Nebraska Lexicon,Condition,S,Not included - descendant,0,0,0,0
36686480,Injury of left subclavian artery,SNOMED,Condition,S,Not included - descendant,0,0,0,0
35615083,Embolism of artery of left upper limb,SNOMED,Condition,S,Not included - descendant,0,0,0,0
3169251,Ischemic stroke of basal ganglia,Nebraska Lexicon,Condition,S,Not included - descendant,0,0,0,0
35615094,Thrombosis of artery of left lower extremity,SNOMED,Condition,S,Not included - descendant,0,0,0,0
3189490,Celiac artery dissection,Nebraska Lexicon,Condition,S,Not included - descendant,0,0,0,0
4050549,"Closed injury, palmar artery",SNOMED,Condition,S,Not included - descendant,0,0,0,0
4139416,Perforation iliac artery,SNOMED,Condition,S,Not included - descendant,0,0,0,0
4144028,Infected axillofemoral graft,SNOMED,Condition,S,Not included - descendant,0,0,0,0
43021454,Right arterial ligament,SNOMED,Condition,S,Not included - descendant,0,0,0,0
44808747,Occlusion of dorsalis pedis artery,SNOMED,Condition,S,Not included - descendant,0,0,0,0
36686409,Injury of left renal artery,SNOMED,Condition,S,Not included - descendant,0,0,0,0
43021053,Systemic to pulmonary collateral artery from abdominal aorta,SNOMED,Condition,S,Not included - descendant,0,0,0,0
761411,Thrombosis of left internal carotid artery,SNOMED,Condition,S,Not included - descendant,0,0,0,0
761430,Atherosclerosis of bypass graft of right lower limb,SNOMED,Condition,S,Not included - descendant,0,0,0,0
40489394,Vascular ring with malrotation and dextroversion of heart and hypoplasia of right lung and left arterial duct,SNOMED,Condition,S,Not included - descendant,0,0,0,0
3184775,Cerebral infarct complicating carotid stenosis,Nebraska Lexicon,Condition,S,Not included - descendant,0,0,0,0
43021634,Atresia of aortic arch with fibrous cord distal to subclavian artery,SNOMED,Condition,S,Not included - descendant,0,0,0,0
43021443,Anomalous insertion of arterial ligament into right pulmonary artery,SNOMED,Condition,S,Not included - descendant,0,0,0,0
36686438,Laceration of right brachial artery,SNOMED,Condition,S,Not included - descendant,0,0,0,0
35615058,Dissection of right renal artery,SNOMED,Condition,S,Not included - descendant,0,0,0,0
35615096,Thrombosis of right popliteal artery,SNOMED,Condition,S,Not included - descendant,0,0,0,0
35615116,Bilateral lower limb atherosclerosis of non-biological bypass graft,SNOMED,Condition,S,Not included - descendant,0,0,0,0
761436,Dissection of right iliac artery,SNOMED,Condition,S,Not included - descendant,0,0,0,0
42536338,Occlusion of left pontine artery,SNOMED,Condition,S,Not included - descendant,0,0,0,0
3172779,Transection of femoral artery,Nebraska Lexicon,Condition,S,Not included - descendant,0,0,0,0
42536243,Embolus of right middle cerebral artery,SNOMED,Condition,S,Not included - descendant,0,0,0,0
43021430,Anomalous origin of left common carotid artery from brachiocephalic artery,SNOMED,Condition,S,Not included - descendant,0,0,0,0
35615076,Occlusion of distal artery of left upper limb,SNOMED,Condition,S,Not included - descendant,0,0,0,0
761428,Stenosis of left renal artery,SNOMED,Condition,S,Not included - descendant,0,0,0,0
40491457,Aneurysm of aortic sinus of Valsalva with rupture to left ventricle,SNOMED,Condition,S,Not included - descendant,0,0,0,0
45766109,Asymptomatic occlusion of basilar artery,SNOMED,Condition,S,Not included - descendant,0,0,0,0
765301,Claudication of right upper limb co-occurrent and due to atherosclerosis,SNOMED,Condition,S,Not included - descendant,0,0,0,0
4146011,Aortocolonic fistula,SNOMED,Condition,S,Not included - descendant,0,0,0,0
37204661,Multiple aneurysms of cerebral artery,SNOMED,Condition,S,Not included - descendant,0,0,0,0
44813802,Thrombosis of stent of renal artery,SNOMED,Condition,S,Not included - descendant,0,0,0,0
35615099,Thrombosis of right common femoral artery,SNOMED,Condition,S,Not included - descendant,0,0,0,0
44807043,Leaking thoracic aortic aneurysm,SNOMED,Condition,S,Not included - descendant,0,0,0,0
37109923,Acute occlusion of artery of lower limb due to thrombosis,SNOMED,Condition,S,Not included - descendant,0,0,0,0
35615075,Occlusion of distal artery of right upper limb,SNOMED,Condition,S,Not included - descendant,0,0,0,0
4111853,Embolism and thrombosis of hepatic artery,SNOMED,Condition,S,Not included - descendant,0,0,0,0
764497,Occlusive embolus of right vertebral artery,SNOMED,Condition,S,Not included - descendant,0,0,0,0
35607996,Retinal arterial macroaneurysm with supravalvular pulmonic stenosis,SNOMED,Condition,S,Not included - descendant,0,0,0,0
42538998,Thrombosis of right middle cerebral artery,SNOMED,Condition,S,Not included - descendant,0,0,0,0
44813823,Occlusion of radial artery,SNOMED,Condition,S,Not included - descendant,0,0,0,0
37108912,Bilateral vertebral artery dissection,SNOMED,Condition,S,Not included - descendant,0,0,0,0
40488003,Aortic left ventricular tunnel with right coronary artery from tunnel,SNOMED,Condition,S,Not included - descendant,0,0,0,0
761743,Atheroembolism of bilateral renal arteries,SNOMED,Condition,S,Not included - descendant,0,0,0,0
37310623,Bilateral occlusion of central retinal arteries,SNOMED,Condition,S,Not included - descendant,0,0,0,0
765081,Macroaneurysm of retina of left eye,SNOMED,Condition,S,Not included - descendant,0,0,0,0
763009,Multiple and bilateral precerebral arterial occlusion with infarction,SNOMED,Condition,S,Not included - descendant,0,0,0,0
35615054,Bilateral subclavian artery stenosis,SNOMED,Condition,S,Not included - descendant,0,0,0,0
43531717,Anterior choroidal artery thrombosis,SNOMED,Condition,S,Not included - descendant,0,0,0,0
764446,Occlusion of right posterior communicating artery,SNOMED,Condition,S,Not included - descendant,0,0,0,0
35624151,Neuhauser anomaly,SNOMED,Condition,S,Not included - descendant,0,0,0,0
761826,Atherosclerosis of bypass graft of right lower limb with intermittent claudication,SNOMED,Condition,S,Not included - descendant,0,0,0,0
761211,Aneurysm of right radial artery,SNOMED,Condition,S,Not included - descendant,0,0,0,0
40490968,Aortic arch hypoplasia between subclavian and common carotid arteries,SNOMED,Condition,S,Not included - descendant,0,0,0,0
762345,Left vertebral artery thrombosis with stroke,SNOMED,Condition,S,Not included - descendant,0,0,0,0
4109324,Preductal aortic stenosis,SNOMED,Condition,S,Not included - descendant,0,0,0,0
4109320,Aortic arch centrally descending,SNOMED,Condition,S,Not included - descendant,0,0,0,0
37309659,Spontaneous hemorrhage of subarachnoid space from anterior communicating artery,SNOMED,Condition,S,Not included - descendant,0,0,0,0
36686518,Injury of left popliteal artery,SNOMED,Condition,S,Not included - descendant,0,0,0,0
35615089,Embolism of artery of right lower limb,SNOMED,Condition,S,Not included - descendant,0,0,0,0
42535420,Spontaneous hemorrhage of subarachnoid space from basilar artery,SNOMED,Condition,S,Not included - descendant,0,0,0,0
36686410,Laceration of splenic artery,SNOMED,Condition,S,Not included - descendant,0,0,0,0
35615093,Thrombosis of artery of right lower extremity,SNOMED,Condition,S,Not included - descendant,0,0,0,0
4139419,Rupture brachial artery,SNOMED,Condition,S,Not included - descendant,0,0,0,0
761463,Ischemia of left lower extremity,SNOMED,Condition,S,Not included - descendant,0,0,0,0
42536638,Perforation of abdominal aorta co-occurrent and due to aneurysm of abdominal aorta,SNOMED,Condition,S,Not included - descendant,0,0,0,0
4050555,"Closed injury, superficial femoral artery",SNOMED,Condition,S,Not included - descendant,0,0,0,0
4144948,Aortojejunal fistula,SNOMED,Condition,S,Not included - descendant,0,0,0,0
4245437,Congenital duplication of aorta,SNOMED,Condition,S,Not included - descendant,0,0,0,0
37204671,Aneurysm of internal carotid-posterior communicating artery zone,SNOMED,Condition,S,Not included - descendant,0,0,0,0
4109326,Postductal interruption of aorta,SNOMED,Condition,S,Not included - descendant,0,0,0,0
40483313,Isolation of right subclavian artery,SNOMED,Condition,S,Not included - descendant,0,0,0,0
764496,Occlusive embolus of left vertebral artery,SNOMED,Condition,S,Not included - descendant,0,0,0,0
43021320,Vascular ring with right aortic arch and left arterial duct from retroesophageal diverticulum of aorta,SNOMED,Condition,S,Not included - descendant,0,0,0,0
761208,Aneurysm of left external iliac artery,SNOMED,Condition,S,Not included - descendant,0,0,0,0
4056439,Closed injury of subclavian artery,SNOMED,Condition,S,Not included - descendant,0,0,0,0
761433,Atherosclerosis of autologous bypass graft of bilateral lower limbs,SNOMED,Condition,S,Not included - descendant,0,0,0,0
36715760,Anterior cord syndrome of lumbar spinal cord at L4 level,SNOMED,Condition,S,Not included - descendant,0,0,0,0
761742,Atheroembolism of right renal artery,SNOMED,Condition,S,Not included - descendant,0,0,0,0
37312367,Bilateral occlusion of pontine arteries,SNOMED,Condition,S,Not included - descendant,0,0,0,0
43021221,Anomalous origin of arterial ligament from retroesophageal aortic diverticulum,SNOMED,Condition,S,Not included - descendant,0,0,0,0
4109318,Aortic tunnel,SNOMED,Condition,S,Not included - descendant,0,0,0,0
761805,Stenosis of artery of left upper limb,SNOMED,Condition,S,Not included - descendant,0,0,0,0
4109476,Juxtaductal aortic coarctation,SNOMED,Condition,S,Not included - descendant,0,0,0,0
765080,Atherosclerosis of bypass graft of left lower limb,SNOMED,Condition,S,Not included - descendant,0,0,0,0
4120955,Intra-aortic balloon infection,SNOMED,Condition,S,Not included - descendant,0,0,0,0
43021442,Anomalous insertion of arterial ligament into pulmonary trunk,SNOMED,Condition,S,Not included - descendant,0,0,0,0
36716127,Isotretinoin-like syndrome,SNOMED,Condition,S,Not included - descendant,0,0,0,0
36685007,Microaneurysm of right retinal artery,SNOMED,Condition,S,Not included - descendant,0,0,0,0
4113294,Preductal interruption of aorta,SNOMED,Condition,S,Not included - descendant,0,0,0,0
760870,Atherosclerosis of arteries of left lower limb,SNOMED,Condition,S,Not included - descendant,0,0,0,0
42536337,Occlusion of right pontine artery,SNOMED,Condition,S,Not included - descendant,0,0,0,0
35624311,"Pulmonary valve agenesis, tetralogy of Fallot, absence of ductus arteriosus syndrome",SNOMED,Condition,S,Not included - descendant,0,0,0,0
43021451,Anomalous origin of arterial ligament from left subclavian artery,SNOMED,Condition,S,Not included - descendant,0,0,0,0
